{"contract_version":"1.2.0","competition":{"id":"serie_a","name":"Serie A","country":"Italy","season":"2026-27"},"generated_at":"2026-10-26T11:30:07Z","data_through":"2026-10-25","latest_result":{"date":"2026-10-25","home_team":"Udinese","away_team":"AC Milan","home_goals":0,"away_goals":2},"provisional":false,"notices":[],"run":{"seed":1588788975,"seed_rule":"first 4 bytes of sha256('<run date, UTC, YYYY-MM-DD>|<competition id>'), big-endian","n_simulations":10000,"code_commit":"1def782fc2e827e8dfdfd8edf70b68fc286e7158","code_dirty":false,"pipeline_hash":"sha256:8022e82b8c20251c254f0e77ac47e6a21dc7125c0a7287242b7f9156cd873b24","config_hash":"sha256:47994218a1da99e1920f4e2c060fe80c184c56a46ac8baccf30b7adce82b044c","config_files":["configs/competitions/serie_a.yaml","configs/team_aliases.yaml","configs/points_deductions.yaml","configs/awarded_results.yaml","configs/playoff_results.yaml"],"model":{"fitted_through":"2026-10-25","promoted_strategy":"prior","promoted_teams":["Frosinone","Monza","Venezia"],"strength_uncertainty":"each simulated season draws its ratings from the fit's uncertainty","match_predictions":"best-estimate ratings (the season simulations also draw rating uncertainty)"}},"sources":[{"loader":"football_data_uk","role":"results","params":{"division":"I1","odds_preference":["PSC","AvgC"],"seasons":["2010-11","2011-12","2012-13","2013-14","2014-15","2015-16","2016-17","2017-18","2018-19","2019-20","2020-21","2021-22","2022-23","2023-24","2024-25","2025-26","2026-27"]}},{"loader":"football_data_org","role":"results","params":{"competition_code":"SA","seasons":["2026-27"]}},{"loader":"football_data_org","role":"fixtures","params":{"competition_code":"SA","seasons":["2026-27"]}}],"zones":[{"id":"title","label":"Win the title","positions":[1]},{"id":"top_four","label":"Top four","positions":[1,2,3,4]},{"id":"top_five","label":"Top five","positions":[1,2,3,4,5]},{"id":"top_half","label":"Top half","positions":[1,2,3,4,5,6,7,8,9,10]},{"id":"relegation","label":"Relegation to Serie B","positions":[18,19,20]}],"table":[{"position":1,"team":"Inter Milan","played":8,"won":7,"drawn":1,"lost":0,"goals_for":23,"goals_against":10,"goal_difference":13,"points":22,"points_deducted":0},{"position":2,"team":"Lazio","played":8,"won":7,"drawn":1,"lost":0,"goals_for":16,"goals_against":5,"goal_difference":11,"points":22,"points_deducted":0},{"position":3,"team":"Roma","played":8,"won":5,"drawn":3,"lost":0,"goals_for":19,"goals_against":6,"goal_difference":13,"points":18,"points_deducted":0},{"position":4,"team":"AC Milan","played":8,"won":5,"drawn":3,"lost":0,"goals_for":16,"goals_against":7,"goal_difference":9,"points":18,"points_deducted":0},{"position":5,"team":"Como","played":8,"won":5,"drawn":2,"lost":1,"goals_for":14,"goals_against":7,"goal_difference":7,"points":17,"points_deducted":0},{"position":6,"team":"Juventus","played":8,"won":4,"drawn":2,"lost":2,"goals_for":11,"goals_against":8,"goal_difference":3,"points":14,"points_deducted":0},{"position":7,"team":"Frosinone","played":8,"won":4,"drawn":2,"lost":2,"goals_for":17,"goals_against":13,"goal_difference":4,"points":14,"points_deducted":0},{"position":8,"team":"Torino","played":8,"won":4,"drawn":1,"lost":3,"goals_for":13,"goals_against":11,"goal_difference":2,"points":13,"points_deducted":0},{"position":9,"team":"Cagliari","played":8,"won":4,"drawn":1,"lost":3,"goals_for":6,"goals_against":9,"goal_difference":-3,"points":13,"points_deducted":0},{"position":10,"team":"Napoli","played":8,"won":3,"drawn":2,"lost":3,"goals_for":13,"goals_against":10,"goal_difference":3,"points":11,"points_deducted":0},{"position":11,"team":"Atalanta","played":8,"won":3,"drawn":1,"lost":4,"goals_for":14,"goals_against":15,"goal_difference":-1,"points":10,"points_deducted":0},{"position":12,"team":"Lecce","played":8,"won":3,"drawn":0,"lost":5,"goals_for":9,"goals_against":14,"goal_difference":-5,"points":9,"points_deducted":0},{"position":13,"team":"Bologna","played":8,"won":2,"drawn":2,"lost":4,"goals_for":8,"goals_against":10,"goal_difference":-2,"points":8,"points_deducted":0},{"position":14,"team":"Sassuolo","played":8,"won":2,"drawn":2,"lost":4,"goals_for":12,"goals_against":16,"goal_difference":-4,"points":8,"points_deducted":0},{"position":15,"team":"Monza","played":8,"won":2,"drawn":1,"lost":5,"goals_for":15,"goals_against":18,"goal_difference":-3,"points":7,"points_deducted":0},{"position":16,"team":"Genoa","played":8,"won":2,"drawn":1,"lost":5,"goals_for":6,"goals_against":13,"goal_difference":-7,"points":7,"points_deducted":0},{"position":17,"team":"Udinese","played":8,"won":1,"drawn":1,"lost":6,"goals_for":9,"goals_against":18,"goal_difference":-9,"points":4,"points_deducted":0},{"position":18,"team":"Fiorentina","played":8,"won":1,"drawn":1,"lost":6,"goals_for":9,"goals_against":19,"goal_difference":-10,"points":4,"points_deducted":0},{"position":19,"team":"Parma","played":8,"won":1,"drawn":1,"lost":6,"goals_for":5,"goals_against":15,"goal_difference":-10,"points":4,"points_deducted":0},{"position":20,"team":"Venezia","played":8,"won":1,"drawn":0,"lost":7,"goals_for":6,"goals_against":17,"goal_difference":-11,"points":3,"points_deducted":0}],"teams":[{"team":"Inter Milan","position_now":1,"points_now":22,"expected_points":85.9175,"points_p10":76.0,"points_p90":95.0,"expected_position":1.4751,"zones":{"title":0.7184,"top_four":0.9798,"top_five":0.9901,"top_half":1.0,"relegation":0.0},"finishing_positions":[0.7184,0.1714,0.0626,0.0274,0.0103,0.0055,0.0032,0.0012,0.0,0.0,0.0,0.0,0.0,0.0,0.0,0.0,0.0,0.0,0.0,0.0]},{"team":"Roma","position_now":3,"points_now":18,"expected_points":75.5167,"points_p10":65.0,"points_p90":85.0,"expected_position":3.2353,"zones":{"title":0.1313,"top_four":0.7833,"top_five":0.8746,"top_half":0.9984,"relegation":0.0},"finishing_positions":[0.1313,0.3128,0.2011,0.1381,0.0913,0.0603,0.0352,0.0191,0.0068,0.0024,0.0006,0.0004,0.0002,0.0001,0.0002,0.0001,0.0,0.0,0.0,0.0]},{"team":"Como","position_now":5,"points_now":17,"expected_points":71.0028,"points_p10":60.0,"points_p90":82.0,"expected_position":4.3445,"zones":{"title":0.0628,"top_four":0.5856,"top_five":0.7212,"top_half":0.9885,"relegation":0.0},"finishing_positions":[0.0628,0.1621,0.1917,0.169,0.1356,0.1048,0.0779,0.0507,0.024,0.0099,0.0066,0.0035,0.001,0.0,0.0003,0.0001,0.0,0.0,0.0,0.0]},{"team":"AC Milan","position_now":4,"points_now":18,"expected_points":69.1093,"points_p10":59.0,"points_p90":79.0,"expected_position":4.8488,"zones":{"title":0.0334,"top_four":0.4787,"top_five":0.6315,"top_half":0.9864,"relegation":0.0},"finishing_positions":[0.0334,0.1254,0.1584,0.1615,0.1528,0.143,0.1024,0.0578,0.0352,0.0165,0.0075,0.0032,0.0018,0.0005,0.0005,0.0001,0.0,0.0,0.0,0.0]},{"team":"Lazio","position_now":2,"points_now":22,"expected_points":68.1432,"points_p10":58.0,"points_p90":79.0,"expected_position":5.1375,"zones":{"title":0.0285,"top_four":0.4276,"top_five":0.5846,"top_half":0.9826,"relegation":0.0},"finishing_positions":[0.0285,0.1034,0.1393,0.1564,0.157,0.1423,0.1117,0.0837,0.04,0.0203,0.0087,0.0052,0.0023,0.0009,0.0,0.0003,0.0,0.0,0.0,0.0]},{"team":"Juventus","position_now":6,"points_now":14,"expected_points":65.5136,"points_p10":55.0,"points_p90":76.0,"expected_position":5.8575,"zones":{"title":0.0148,"top_four":0.305,"top_five":0.4565,"top_half":0.9669,"relegation":0.0001},"finishing_positions":[0.0148,0.0555,0.1055,0.1292,0.1515,0.1572,0.1489,0.1118,0.0622,0.0303,0.0161,0.0077,0.0051,0.0021,0.0012,0.0004,0.0004,0.0001,0.0,0.0]},{"team":"Napoli","position_now":10,"points_now":11,"expected_points":64.4067,"points_p10":54.0,"points_p90":75.0,"expected_position":6.1959,"zones":{"title":0.0079,"top_four":0.2647,"top_five":0.405,"top_half":0.9538,"relegation":0.0005},"finishing_positions":[0.0079,0.048,0.0874,0.1214,0.1403,0.154,0.154,0.126,0.0742,0.0406,0.0203,0.013,0.0072,0.0024,0.0018,0.0007,0.0003,0.0004,0.0001,0.0]},{"team":"Atalanta","position_now":11,"points_now":10,"expected_points":60.3758,"points_p10":50.0,"points_p90":71.0,"expected_position":7.4427,"zones":{"title":0.0023,"top_four":0.1332,"top_five":0.2369,"top_half":0.8849,"relegation":0.001},"finishing_positions":[0.0023,0.0175,0.0433,0.0701,0.1037,0.1208,0.1583,0.166,0.1274,0.0755,0.0503,0.0269,0.0159,0.0091,0.0062,0.0042,0.0015,0.0008,0.0002,0.0]},{"team":"Bologna","position_now":13,"points_now":8,"expected_points":51.0765,"points_p10":41.0,"points_p90":62.0,"expected_position":10.5936,"zones":{"title":0.0001,"top_four":0.0158,"top_five":0.0379,"top_half":0.5311,"relegation":0.0213},"finishing_positions":[0.0001,0.001,0.0048,0.0099,0.0221,0.0366,0.0631,0.1014,0.1448,0.1473,0.1198,0.1011,0.0793,0.0595,0.0385,0.0292,0.0202,0.0117,0.0073,0.0023]},{"team":"Torino","position_now":8,"points_now":13,"expected_points":48.8093,"points_p10":39.0,"points_p90":59.0,"expected_position":11.4048,"zones":{"title":0.0,"top_four":0.0078,"top_five":0.0192,"top_half":0.4061,"relegation":0.0274},"finishing_positions":[0.0,0.0003,0.002,0.0055,0.0114,0.0239,0.0426,0.0726,0.1141,0.1337,0.1308,0.1242,0.099,0.0785,0.0643,0.0417,0.028,0.0141,0.0098,0.0035]},{"team":"Frosinone","position_now":7,"points_now":14,"expected_points":47.6622,"points_p10":36.0,"points_p90":59.0,"expected_position":11.913,"zones":{"title":0.0005,"top_four":0.0116,"top_five":0.0222,"top_half":0.3628,"relegation":0.0565},"finishing_positions":[0.0005,0.002,0.0022,0.0069,0.0106,0.0204,0.036,0.0675,0.0991,0.1176,0.1203,0.1058,0.0949,0.0843,0.0723,0.0578,0.0453,0.0292,0.0188,0.0085]},{"team":"Cagliari","position_now":9,"points_now":13,"expected_points":45.1045,"points_p10":35.0,"points_p90":55.0,"expected_position":12.8764,"zones":{"title":0.0,"top_four":0.0025,"top_five":0.0074,"top_half":0.2331,"relegation":0.072},"finishing_positions":[0.0,0.0002,0.0006,0.0017,0.0049,0.0088,0.0199,0.038,0.0663,0.0927,0.1112,0.1158,0.1171,0.1139,0.0985,0.0798,0.0586,0.0362,0.0247,0.0111]},{"team":"Sassuolo","position_now":14,"points_now":8,"expected_points":44.33,"points_p10":34.0,"points_p90":55.0